{
  "schema_version": "1.0.0",
  "record_type": "review_comment",
  "id": "review-immune-rejuvenation-approval",
  "name": "Curator approval for immune rejuvenation wording update",
  "candidate_bundle_id": "immune-rejuvenation-update-2026-05-30",
  "author_role": "human_reviewer",
  "comment_type": "approval",
  "body": "Approved for publication. The revised wording improves legibility without overstating what the evidence means for aging reversal.",
  "created_at": "2026-05-30T18:30:00Z",
  "resolution_status": "closed",
  "applies_to_change_id": "refresh-immune-rejuvenation-outlook",
  "applies_to_record": {
    "record_type": "outlook",
    "record_id": "track-immune-rejuvenation-outlook"
  },
  "tags": [
    "admin"
  ]
}
