{
  "schema_version": "1.0.0",
  "record_type": "review_comment",
  "id": "review-rapalogs-bundle-response",
  "name": "Agent revision response for rapalogs bundle",
  "candidate_bundle_id": "rapalogs-update-2026-05-30",
  "author_role": "agent",
  "comment_type": "response",
  "body": "Updated the outlook note and activity significance language to keep the stage assignment unchanged.",
  "created_at": "2026-05-30T17:10:00Z",
  "resolution_status": "closed",
  "parent_comment_id": "review-rapalogs-bundle-request",
  "applies_to_change_id": "update-rapalogs-outlook",
  "applies_to_record": {
    "record_type": "outlook",
    "record_id": "rapalogs-track-outlook"
  },
  "tags": [
    "review",
    "example"
  ]
}
