{
  "schema_version": "1.0.0",
  "record_type": "review_comment",
  "id": "review-rapalogs-bundle-request",
  "name": "Curator request for clearer significance note",
  "candidate_bundle_id": "rapalogs-update-2026-05-30",
  "author_role": "human_reviewer",
  "comment_type": "request_changes",
  "body": "Clarify that the trial update is contextual only and does not move the public stage assignment.",
  "created_at": "2026-05-30T17:00:00Z",
  "resolution_status": "addressed",
  "applies_to_change_id": "update-rapalogs-outlook",
  "applies_to_record": {
    "record_type": "outlook",
    "record_id": "track-rapalogs-outlook"
  },
  "addressed_by_comment_id": "review-rapalogs-bundle-response",
  "addressed_at": "2026-05-30T17:10:00Z",
  "tags": [
    "public"
  ]
}
