{
  "schema_version": "1.0.0",
  "record_type": "review_comment",
  "id": "review-partial-reprogramming-response",
  "name": "Agent revision foregrounding translation risk",
  "candidate_bundle_id": "partial-reprogramming-update-2026-05-29",
  "author_role": "agent",
  "comment_type": "response",
  "body": "The staged outlook now puts the absence of direct human intervention evidence in the first sentence and frames the rest as conceptual promise rather than near-term forecast.",
  "created_at": "2026-05-30T18:25:00Z",
  "resolution_status": "closed",
  "parent_comment_id": "review-partial-reprogramming-request",
  "applies_to_change_id": "revise-partial-reprogramming-outlook",
  "applies_to_evidence_review_id": "evidence-review-partial-reprogramming-interpretation-r2",
  "applies_to_finding_id": "partial-r2-translation-risk-prominence",
  "applies_to_record": {
    "record_type": "outlook",
    "record_id": "track-partial-reprogramming-outlook"
  },
  "tags": [
    "admin"
  ]
}
